{
  "kind": "Source",
  "id": "source-krueger-werner-2005-problem-18",
  "title": "Some open problems in quantum information theory",
  "authors": ["O. Krüger", "R. F. Werner"],
  "venue": "arXiv:quant-ph/0504166 (2005); snapshot of the IMaPh open-problems collection, TU Braunschweig",
  "url": "https://doi.org/10.48550/arXiv.quant-ph/0504166"
}
