{
  "kind": "Source",
  "id": "source-augusiak-2012-tight-bell-no-violation",
  "title": "Tight Bell inequalities with no quantum violation from qubit unextendible product bases",
  "authors": [
    "R. Augusiak et al."
  ],
  "venue": "Phys. Rev. A 85, 042113 (2012); arXiv:1112.3238",
  "url": "https://arxiv.org/abs/1112.3238"
}
