{
  "kind": "Source",
  "id": "source-hiroshima-2003-majorization",
  "title": "Majorization criterion for distillability of a bipartite quantum state",
  "authors": [
    "T. Hiroshima"
  ],
  "venue": "Phys. Rev. Lett. 91, 057902 (2003); arXiv:quant-ph/0303057",
  "url": "https://arxiv.org/abs/quant-ph/0303057"
}
