{
  "kind": "Source",
  "id": "source-de-vicente-2024-mems-nonexistence",
  "title": "Maximally entangled mixed states for a fixed spectrum do not always exist",
  "authors": [
    "J. I. de Vicente"
  ],
  "venue": "Phys. Rev. Lett. 133, 050202 (2024); arXiv:2402.05673",
  "url": "https://arxiv.org/abs/2402.05673"
}
