{
  "kind": "Source",
  "id": "source-berta-2011-reverse-shannon-one-shot",
  "title": "The Quantum Reverse Shannon Theorem Based on One-Shot Information Theory",
  "authors": [
    "M. Berta",
    "M. Christandl",
    "R. Renner"
  ],
  "venue": "Commun. Math. Phys. 306, 579 (2011); arXiv:0912.3805",
  "url": "https://arxiv.org/abs/0912.3805"
}
